lat,category,raw_text,preprocessed_text,is_text_missing,is_llava_imputed
47.356964,works_well,the seats are clean I want to sit on clean seats Regular cleaning and mindfulness of passengers daily in train and bus,the seats are clean i want to sit on clean seats regular cleaning and mindfulness of passengers daily in train and bus,False,False
55.781197,works_well,,,True,False
47.55716,problem,Underpasses Old Town-Archhöfe Underpass is only useful for passers-by between the old town and Archöfe. The underpass is therefore poorly used.,underpasses old town archhöfe underpass is only useful for passers by between the old town and archöfe the underpass is therefore poorly used,False,False
,problem,Connecting train delayed.,connecting train delayed,False,False
47.397484,problem,"Traffic creating delays In the picture isn't appreciated, but is a lot of traffic in this area between two gas stations near the shooting range. Every time the bus crosses this roundabout, gets delayed due to the traffic Well the cars going in and out of the gas station and supermarkets create the delays, maybe opening another lane that facilitates the cars leaving Winterthur helps the traffic.",traffic creating delays in the picture isn t appreciated but is a lot of traffic in this area between two gas stations near the shooting range every time the bus crosses this roundabout gets delayed due to the traffic well the cars going in and out of the gas station and supermarkets create the delays maybe opening another lane that facilitates the cars leaving winterthur helps the traffic,False,False
47.501602,problem,Even more garbage on the way to the station,even more garbage on the way to the station,False,False
47.501602,problem,"Lots of garbage on the way to the station and around the station. Ungood feeling, reduction of location quality",lots of garbage on the way to the station and around the station ungood feeling reduction of location quality,False,False
47.501602,problem,Bright soils often polluted  More cleanings or other floor paint,bright soils often polluted more cleanings or other floor paint,False,False
47.501602,problem,Information panel defective It hasn't worked for months and has never been repaired Regular control and maintenance rounds,information panel defective it hasn t worked for months and has never been repaired regular control and maintenance rounds,False,False
47.501923,problem,Disabled access to the platform is very far from the shelter Disabled people must go much further down a relatively narrow platform to shelter from bad weather. I-I-I-I-I-I-I-I-I-I-I-I-I-I-I-I-I-I-I-I-I-I-I-I-I-I-I-I-I-I-I-I-I-I-I-I-I-I-I-I-I-I-I-I-I-I-I-I-I-I-I-I-I-I-I-I-I-I-I-I-I-I-I-I-I-I-I-I-I-I-I-I-I-I-I-I-I-I-I-I-I-I-I-I-I-I-I-I-I-I-I-I-I-I-I-I-I-I-I-I-I-I-I-I-I-I-I-I-I-I-I-I-I-I-I-I-I-I-I-I-I-I-I-I-I-I-I-I-I-I-I-I-I-I-I-I-I-I-I-I-I-I-I-I-I-I-I-I-I-I-I-I-I-I-I-I-I-I-I-I-I-I-I-I-I-I-I-I-I-I-I-I-I-I-I-I-I-I-I-I-I-I-I-I-I-I-I-I-I-I-I-I-I-I-I-I-I-I-I-I-I-I-I-I-I-I-I-I-I-I-I-I-I-I-I-I-I-I-I-I-I-I-I-I-I-I-I-I-I-I-I-I-I-I-I-I-I-I-I-I-I-I-I-I-I-I-I Extended the shelter to the disabled access,disabled access to the platform is very far from the shelter disabled people must go much further down a relatively narrow platform to shelter from bad weather i i i i i i i i i i i i i i i i i i i i i i i i i i i i i i i i i i i i i i i i i i i i i i i i i i i i i i i i i i i i i i i i i i i i i i i i i i i i i i i i i i i i i i i i i i i i i i i i i i i i i i i i i i i i i i i i i i i i i i i i i i i i i i i i i i i i i i i i i i i i i i i i i i i i i i i i i i i i i i i i i i i i i i i i i i i i i i i i i i i i i i i i i i i i i i i i i i i i i i i i i i i i i i i i i i i i i i i i i i i i i i i i i i i i i i i i i i i i i i i i i i i i i i i extended the shelter to the disabled access,False,False
47.501923,problem,"At level platform access directly from park The path through the park leads directly onto the platform, where trains pass regularly at relatively high speed. There is a playground nearby and children frequently play close to the station, ride bikes etc. I am Concerned about safety, as it seems that an incident could easily lead to someone landing on the tracks Build a chicane railing to ensure one cannot coincidentally get from the park into the station",at level platform access directly from park the path through the park leads directly onto the platform where trains pass regularly at relatively high speed there is a playground nearby and children frequently play close to the station ride bikes etc i am concerned about safety as it seems that an incident could easily lead to someone landing on the tracks build a chicane railing to ensure one cannot coincidentally get from the park into the station,False,False
,problem,8 minutes late on arrival. Connection train is gone.,8 minutes late on arrival connection train is gone,False,False
47.49825,problem,"Bus came late Its raining so I guess the traffic is worse than usual. But considering that bus lines are free this shouldn't be a problem I believe is just people that rush to get into a crowded bus due to the rain, that possibly delays it. Maybe larger roofs on bus stations",bus came late its raining so i guess the traffic is worse than usual but considering that bus lines are free this shouldn t be a problem i believe is just people that rush to get into a crowded bus due to the rain that possibly delays it maybe larger roofs on bus stations,False,False
47.50159,problem,"Display of non-operation Didn't know exactly where I was, when I arrived, how long the trip still goes",display of non operation didn t know exactly where i was when i arrived how long the trip still goes,False,False
47.50161,problem,Someone who hears his videos and music loudly again:(,someone who hears his videos and music loudly again,False,False
47.50161,problem,"Small luggage storage In the luggage rack has almost nothing, only very flat/slim things, everything else must be stowed under the seat or on itself",small luggage storage in the luggage rack has almost nothing only very flat slim things everything else must be stowed under the seat or on itself,False,False
47.49872,problem,"From Aadorf to Winterthur, Stöhrung an der Bahnanlage",from aadorf to winterthur stöhrung an der bahnanlage,False,False
55.781197,problem,,,True,False
47.365986,problem,"Display on screen not working, neither in- or outside Unclear if the correct train was chosen on the way to Winterthur Fix the technical problem and communicate orally",display on screen not working neither in or outside unclear if the correct train was chosen on the way to winterthur fix the technical problem and communicate orally,False,False
,problem,"Little green, lot of traffic, little alternative foot traffic  More greenry At other mainstreets",little green lot of traffic little alternative foot traffic more greenry at other mainstreets,False,False
47.497894,problem,"no trees, not a lot of green spaces",no trees not a lot of green spaces,False,False
47.49909,problem,Not clear where we can cross,not clear where we can cross,False,False
47.49915,problem,Buses and people get in the way,buses and people get in the way,False,False
47.499554,problem,busy crossing of buses and crossings for pedestrians Many buses queer the intersection and at the same time many pedestrians want to reach the station,busy crossing of buses and crossings for pedestrians many buses queer the intersection and at the same time many pedestrians want to reach the station,False,False
47.49935,problem,Buses and people,buses and people,False,False
,problem,"Lots of concrete, no green There is so much concrete and not a lot of enjoyable space More greenry Zurich Mainition",lots of concrete no green there is so much concrete and not a lot of enjoyable space more greenry zurich mainition,False,False
47.4989,problem,The lower cycling pitches are full. To lift up the bike is laborious. Many would probably put the bike next to the bike places. Offer more ground-level cycling pitches. There are double-storey bicycle parking spaces in many places. Mostly the upper floor is very little used.,the lower cycling pitches are full to lift up the bike is laborious many would probably put the bike next to the bike places offer more ground level cycling pitches there are double storey bicycle parking spaces in many places mostly the upper floor is very little used,False,False
,problem,"To much cable in the sky You cant see the beautiful trainstation because of all the cables Less cable Centeal spots like in zurich centeal, bellevue, albisriederplatz erc.",to much cable in the sky you cant see the beautiful trainstation because of all the cables less cable centeal spots like in zurich centeal bellevue albisriederplatz erc,False,False
47.49771,problem,The crossing of buses people and cars is in the early hours really chaotic You never know if you can cross safely,the crossing of buses people and cars is in the early hours really chaotic you never know if you can cross safely,False,False
47.49951,problem,"Dark non-hospitable area In the basement of the station is this non-hospitable area. Bad light, no seating, no greening or other creative elements. The tables are often stained. The area does not invite you to linger. With an upgrade, e.g. a soft renovation.",dark non hospitable area in the basement of the station is this non hospitable area bad light no seating no greening or other creative elements the tables are often stained the area does not invite you to linger with an upgrade e g a soft renovation,False,False
47.499405,problem,"Pre Information about bus departments When you arrive by train, it is difficult to get a quick overview of the departing buses. If you have little time this can be crucial Let the departures in the next 2' appear significantly larger on the screen. so you will be pointed out faster that you have to hurry and immediately see which edge the bus is driving at",pre information about bus departments when you arrive by train it is difficult to get a quick overview of the departing buses if you have little time this can be crucial let the departures in the next 2 appear significantly larger on the screen so you will be pointed out faster that you have to hurry and immediately see which edge the bus is driving at,False,False
47.498806,problem,Trucks take space Two trucks (come a third one later) were on the sidewalk and on the place. There unloaded. It has less space to walk and it doesn't feel safe. Make a place to unloed.,trucks take space two trucks come a third one later were on the sidewalk and on the place there unloaded it has less space to walk and it doesn t feel safe make a place to unloed,False,False
47.49944,problem,Taxis in th way When going to the bus station you always have to walk through these taxis. A bit dangerous and just annoying. Wrong place for them to wait. Move them to a different location!,taxis in th way when going to the bus station you always have to walk through these taxis a bit dangerous and just annoying wrong place for them to wait move them to a different location,False,False
47.49958,problem,People wait here and block the passage to the train station  Move the department board to somewhere else,people wait here and block the passage to the train station move the department board to somewhere else,False,False
,problem,"When is bad weather (raining ) it is not possible walk dry to the buses The roff can be sleeppery and it is very (""müesam"") Make a greater roof, chanting the design, it is not vedy easy to change.",when is bad weather raining it is not possible walk dry to the buses the roff can be sleeppery and it is very müesam make a greater roof chanting the design it is not vedy easy to change,False,False
47.499237,problem,"Confusing crossing Difficult crossing with buses and taxi. I see a lot of ""close"" calls here. honestly no idea",confusing crossing difficult crossing with buses and taxi i see a lot of close calls here honestly no idea,False,False
,problem,Not accurately levelboarding Not convinient Rise platforms,not accurately levelboarding not convinient rise platforms,False,False
,problem,"Taxis are in the way To get to the station you have to walk through the taxis Yes, you have to move the taxi stand",taxis are in the way to get to the station you have to walk through the taxis yes you have to move the taxi stand,False,False
47.49969,problem,Departure information is available twice. here are two departure screens and at the other entrance (city gate) there is no screen. The departures are also not visible from the bus terminal,departure information is available twice here are two departure screens and at the other entrance city gate there is no screen the departures are also not visible from the bus terminal,False,False
47.500397,problem,Door opens to customers It blocks the door and makes a lot of noise. Doors that open outside.,door opens to customers it blocks the door and makes a lot of noise doors that open outside,False,False
,problem,"Not friendly, feels not safe Due to wide lanes speeding is encouraged. Makes the road maller, make the sidewalks and bycicle path.",not friendly feels not safe due to wide lanes speeding is encouraged makes the road maller make the sidewalks and bycicle path,False,False
47.49873,problem,"No way for bikes to cross the train station, but they are working on it at the moment.",no way for bikes to cross the train station but they are working on it at the moment,False,False
,problem,Not friendly Smog. Noise. Locate out of town.,not friendly smog noise locate out of town,False,False
47.498714,problem,Bike riders loose a lot of time crossing the railway tracks as they have to walk in the subway,bike riders loose a lot of time crossing the railway tracks as they have to walk in the subway,False,False
,problem,"Weird structure, very plain. Does not upgrade the view of the street. Replace with greener things.",weird structure very plain does not upgrade the view of the street replace with greener things,False,False
47.49911,problem,"No waste separation Those who value waste separation do not like to use these buckets. Replace with separate multi-waste buckets. At small stations there is almost never waste separation. Especially pet bottles I often dispose of at stations. But if the separation is missing, I prefer to take it with me to the next big station.",no waste separation those who value waste separation do not like to use these buckets replace with separate multi waste buckets at small stations there is almost never waste separation especially pet bottles i often dispose of at stations but if the separation is missing i prefer to take it with me to the next big station,False,False
47.4993,problem,Hard to find if you are in a rush,hard to find if you are in a rush,False,False
47.498993,problem,Parking A parking lot has almost no benefit for commuters. The vehicles are not a beautiful sight. Pick up the parking lot or an underground car park.,parking a parking lot has almost no benefit for commuters the vehicles are not a beautiful sight pick up the parking lot or an underground car park,False,False
47.498867,problem,A waste mountain Such a mountain of garbage bags is ugly. Directly next to the station is Maag Recycling. The recycling area right next to the station is basically very uncomfortable. It causes noise and looks very chaotic. Maag Recycling should be relocated. The area could be used much more meaningfully.,a waste mountain such a mountain of garbage bags is ugly directly next to the station is maag recycling the recycling area right next to the station is basically very uncomfortable it causes noise and looks very chaotic maag recycling should be relocated the area could be used much more meaningfully,False,False
47.499496,problem,"No driving in underpass is often ignored by cyclists.  However, bicycles officially allow to drive slowly with notice.",no driving in underpass is often ignored by cyclists however bicycles officially allow to drive slowly with notice,False,False
47.498817,problem,All concrete Unbelievable and not welcome Paint the walls,all concrete unbelievable and not welcome paint the walls,False,False
47.500214,problem,Paint point. Hard to cross with bikes,paint point hard to cross with bikes,False,False
,problem,Sterile guide grit The underpass is nice bright but a little monotonous You could meh with colors what to do But bright colors so it's not too dark,sterile guide grit the underpass is nice bright but a little monotonous you could meh with colors what to do but bright colors so it s not too dark,False,False
47.49914,problem,No bike access? No bike access,no bike access no bike access,False,False
47.499596,problem,,,True,False
47.498962,problem,Not a nice shelter if it rains,not a nice shelter if it rains,False,False
47.49914,problem,Usless place Empty lot not nice to look at A couple of benches and trees would be nice,usless place empty lot not nice to look at a couple of benches and trees would be nice,False,False
,problem,"Relatively dark station No good lighting, even during day Open up the top with glass",relatively dark station no good lighting even during day open up the top with glass,False,False
47.49874,problem,Missing ticket machine on the back of the station. Whoever comes from this side must pass under the whole station to solve a ticket. Place ticket machine,missing ticket machine on the back of the station whoever comes from this side must pass under the whole station to solve a ticket place ticket machine,False,False
,problem,Not inviting to stay long A little dystopian old vibe Repaint and put in more bright colors,not inviting to stay long a little dystopian old vibe repaint and put in more bright colors,False,False
47.499657,problem,"It's too dark No place for long stays More glass, better lighting paint the station white",it s too dark no place for long stays more glass better lighting paint the station white,False,False
47.49957,problem,"Delay in train Onward journey, time is money",delay in train onward journey time is money,False,False
,problem,Why block the entrance on a bycicle connection Does not enhance the use of the velo station Remove the blockera,why block the entrance on a bycicle connection does not enhance the use of the velo station remove the blockera,False,False
47.499275,problem,Pollution on the tracks  Buses for pollution,pollution on the tracks buses for pollution,False,False
47.49901,problem,Bike parking entrance to narrow You can't drive directly to the parking lot Broader ascent without building such a curve,bike parking entrance to narrow you can t drive directly to the parking lot broader ascent without building such a curve,False,False
,problem,"Noone sees this peoplecrossing signal No good signaling or markings, so nobody realizes that there is a redlight potentially. Mark the ground with a streetcrossing",noone sees this peoplecrossing signal no good signaling or markings so nobody realizes that there is a redlight potentially mark the ground with a streetcrossing,False,False
47.500957,problem,"Roofing Very dark, not nice roofing. Even in daylight the station feels gloomy. Upgrade of the roofing. more light.",roofing very dark not nice roofing even in daylight the station feels gloomy upgrade of the roofing more light,False,False
47.49885,problem,No green plants Too little water Pay More Attention,no green plants too little water pay more attention,False,False
47.49752,problem,"no crossing to the other side dangerous to get to the other side, long walk to other crossings make a crossing",no crossing to the other side dangerous to get to the other side long walk to other crossings make a crossing,False,False
47.49792,problem,"What is this? Road, car park or pavement? Once got run over here Get rid of this stupid secondary road and parking spaces",what is this road car park or pavement once got run over here get rid of this stupid secondary road and parking spaces,False,False
47.497955,problem,Pedestrian crossing not clearly visible that it is also an exit pedestrians often run over red and you are not aware Create markings on the ground,pedestrian crossing not clearly visible that it is also an exit pedestrians often run over red and you are not aware create markings on the ground,False,False
47.497566,problem,Physics buildings does not fit into the cityscape New construction,physics buildings does not fit into the cityscape new construction,False,False
47.49829,problem,cars standing around Cars that are illegally standing around in the car-free old town. The cars are ugly and disturb the cityscape. Do not make the old town accessible with bollards and barrier system. Spread more controls and parking buses.,cars standing around cars that are illegally standing around in the car free old town the cars are ugly and disturb the cityscape do not make the old town accessible with bollards and barrier system spread more controls and parking buses,False,False
47.498013,problem,"People watching loud videos on their phones I just find this very annoying and often distracting. I think the other fitgers should be more respected. They could use headphones. Often used to keep children busy, and that is also often annoying and loud and disstracting. Although I understand why, it is just tiring.",people watching loud videos on their phones i just find this very annoying and often distracting i think the other fitgers should be more respected they could use headphones often used to keep children busy and that is also often annoying and loud and disstracting although i understand why it is just tiring,False,False
47.497284,problem,"Underpass Technikumstrasse It stinks, it's dark, you feel uncomfortable Better lighting, cleanliness In the Bhf underpass was well renovated",underpass technikumstrasse it stinks it s dark you feel uncomfortable better lighting cleanliness in the bhf underpass was well renovated,False,False
47.597015,problem,"Meeting buses/enthusiastics Too many buses and people cross without regulation Underpass, traffic lights, marked paths, fences No",meeting buses enthusiastics too many buses and people cross without regulation underpass traffic lights marked paths fences no,False,False
47.501495,problem,"Footpath ZHAW - Bhf. unfavorable Non-liquid green phase Zebra stripe, old town entrance unclear, is not perceived/noted by pedestrians as little car traffic into the old town. Better visible signaling, prioritization of pedestrian streams or steering of pedestrians on alternative grounds: e.g. via rear warehouse or old town. At the stop Deutweg you will experience the same if you want to go to the indoor pool.",footpath zhaw bhf unfavorable non liquid green phase zebra stripe old town entrance unclear is not perceived noted by pedestrians as little car traffic into the old town better visible signaling prioritization of pedestrian streams or steering of pedestrians on alternative grounds e g via rear warehouse or old town at the stop deutweg you will experience the same if you want to go to the indoor pool,False,False
,problem,Train delayed.,train delayed,False,False
47.482227,problem,,,True,False
