lat,category,raw_text,preprocessed_text,is_text_missing,is_llava_imputed
47.541534,works_well,Trolley bus Good clock on trolleybus connections and sensible lines,trolley bus good clock on trolleybus connections and sensible lines,False,False
47.554565,works_well,"S-Bahn Good S-Bahn connections to all corrections, good pace to the wine country.",s bahn good s bahn connections to all corrections good pace to the wine country,False,False
47.42291,works_well,"Inclusive to parents, disabled and old people The bus has a space where parents can leave the uncomfortable child carriages, for old people to sit and for wheelchairs. This should be strengthened, inclusion is key for people to receive the public transport as a good way of moving around. In tram stations but not aa spacious as in the bus.",inclusive to parents disabled and old people the bus has a space where parents can leave the uncomfortable child carriages for old people to sit and for wheelchairs this should be strengthened inclusion is key for people to receive the public transport as a good way of moving around in tram stations but not aa spacious as in the bus,False,False
47.42291,works_well,"Bike lanes are respected Bikes are one the most sustainable ways of moving, it should be respected and encouraged. Even tho there are some bike lanes and this survey is about public transport, i think bike lanes should be more supported in this Grüze area. It could be maybe strengthened if there were more bike lanes connecting the old town of Winterthur with the Hegi area. And a recreational area for biking (like bmx)",bike lanes are respected bikes are one the most sustainable ways of moving it should be respected and encouraged even tho there are some bike lanes and this survey is about public transport i think bike lanes should be more supported in this grüze area it could be maybe strengthened if there were more bike lanes connecting the old town of winterthur with the hegi area and a recreational area for biking like bmx,False,False
47.378227,works_well,"Future networking opportunities close to bus lines New networking opportunities make the people want to go out more and use this area, easily using more the public transport and less the car, liberating the space that they need in the streets. This would make the flow of buses more punctual. More investments in open spaces, green spaces, parks, cafes, bars, restaurants, etc. Places where people enjoy being, rather than just an industrial gray area.",future networking opportunities close to bus lines new networking opportunities make the people want to go out more and use this area easily using more the public transport and less the car liberating the space that they need in the streets this would make the flow of buses more punctual more investments in open spaces green spaces parks cafes bars restaurants etc places where people enjoy being rather than just an industrial gray area,False,False
47.501602,works_well,"Juhuuu the barrier is up, fortunately I don't have to take the transfer.  Maintaining the barrier, as the route to the station is extremely shortened compared to the overpass.",juhuuu the barrier is up fortunately i don t have to take the transfer maintaining the barrier as the route to the station is extremely shortened compared to the overpass,False,False
47.501602,works_well,,,True,False
47.50161,works_well,Large windows for observing landscapes,large windows for observing landscapes,False,False
47.38898,works_well,plenty of space in the trains It is pleasant and comfortable Also offer long trains at marginal times and do not shorten Partially at marginal times,plenty of space in the trains it is pleasant and comfortable also offer long trains at marginal times and do not shorten partially at marginal times,False,False
47.50247,works_well,On time Bus arrivals and departments on time even on a rainy weather,on time bus arrivals and departments on time even on a rainy weather,False,False
47.499924,works_well,"Heating works very well It got very windy, rainy and cold fast Outside and the busdriver instantly turned on the heating, that works well",heating works very well it got very windy rainy and cold fast outside and the busdriver instantly turned on the heating that works well,False,False
47.49579,works_well,"Bus stop very well delineated Its very important because the people need to know at which position to expect the bus. It makes the exchange of passengers more efficient. Preserved respecting the position, think as a fitting and spread along the lines.",bus stop very well delineated its very important because the people need to know at which position to expect the bus it makes the exchange of passengers more efficient preserved respecting the position think as a fitting and spread along the lines,False,False
47.49674,works_well,"Buses respect their distances 3 buses waiting to leave and pick up passgers, event though they are late, still don't rush and respect their turns and distances. I don't think it can be strengthened anymore, that's swiss culture.",buses respect their distances 3 buses waiting to leave and pick up passgers event though they are late still don t rush and respect their turns and distances i don t think it can be strengthened anymore that s swiss culture,False,False
47.503014,works_well,"Pedestrian crossings at both sides of bus stop You can cross safely once getting off the bus, or going to the stop Not changing it",pedestrian crossings at both sides of bus stop you can cross safely once getting off the bus or going to the stop not changing it,False,False
47.502613,works_well,Estimated arrival time at bus stops I can estimate an exact time of arrival Keep as is On trains,estimated arrival time at bus stops i can estimate an exact time of arrival keep as is on trains,False,False
47.305973,works_well,Seats are usually very clean and in good condition Sitting on dirty seats is unpleasant Clean well Mostly in all trains relatively solid,seats are usually very clean and in good condition sitting on dirty seats is unpleasant clean well mostly in all trains relatively solid,False,False
47.497852,works_well,Bus Its my favorite bus and it drives in a really good frequency. The politicaless of the staff. Every day,bus its my favorite bus and it drives in a really good frequency the politicaless of the staff every day,False,False
47.29661,works_well,"Windows are usually clean and not scratched If you want to look out the window, clean windows are important. Window nice cleaning from the inside and outside In most trains",windows are usually clean and not scratched if you want to look out the window clean windows are important window nice cleaning from the inside and outside in most trains,False,False
47.496235,works_well,Nice view There is a nice view from the bus. Nothing Not really that-s normal in Switzerland.,nice view there is a nice view from the bus nothing not really that s normal in switzerland,False,False
47.50161,works_well,Good fast connections from grüze directly to zürich,good fast connections from grüze directly to zürich,False,False
47.490074,works_well,Stop Storchenbrücke stands on the side where nobody lives.. Place there is sufficient after turning the line 4. Crossing the road is long and dangerous for pedestrians.,stop storchenbrücke stands on the side where nobody lives place there is sufficient after turning the line 4 crossing the road is long and dangerous for pedestrians,False,False
47.49016,works_well,alternative place for bus stop Storchenbrücke line 4 on the side where the passengers live.,alternative place for bus stop storchenbrücke line 4 on the side where the passengers live,False,False
47.49872,works_well,Charging cable station for phone Because you can always use it. Nowadays you are very much at mobile. Especially in the evening when it is already dark I appreciate such stations very Not everytime the station is working More checking And more of that station in the bus. Often there are know who or less At the evening after work and low battery I approach it,charging cable station for phone because you can always use it nowadays you are very much at mobile especially in the evening when it is already dark i appreciate such stations very not everytime the station is working more checking and more of that station in the bus often there are know who or less at the evening after work and low battery i approach it,False,False
47.497776,works_well,Punctual bus Because I get to my destination on time And it's cold outside and so I have to freeze I guess the bus arrives in time Couldnt been better Just happy how it is Often the bus is coming at correct time,punctual bus because i get to my destination on time and it s cold outside and so i have to freeze i guess the bus arrives in time couldnt been better just happy how it is often the bus is coming at correct time,False,False
47.50154,works_well,,,True,False
47.348713,works_well,Local train S-Bahn from Winterthur to Winterthur Grüze super on time Allows punctual arrival to destiny Keep infrastructure and operations management intact,local train s bahn from winterthur to winterthur grüze super on time allows punctual arrival to destiny keep infrastructure and operations management intact,False,False
55.781197,works_well,,,True,False
47.499527,works_well,There's still room It's very quiet Maintaining Moral Practices Mostly in trains that are not too crowded,there s still room it s very quiet maintaining moral practices mostly in trains that are not too crowded,False,False
47.27637,works_well,Delays are made transparent you know what's going on and how much delay the train has continue to communicate well and be honest time and again in everyday life,delays are made transparent you know what s going on and how much delay the train has continue to communicate well and be honest time and again in everyday life,False,False
47.26372,works_well,Animals are allowed in public transport and keepers ensure that the animals behave properly I find this very tolerant from the SBB Do not introduce any animal bans I keep seeing animals in public transport and there have never been any problems,animals are allowed in public transport and keepers ensure that the animals behave properly i find this very tolerant from the sbb do not introduce any animal bans i keep seeing animals in public transport and there have never been any problems,False,False
47.26372,works_well,"even if it gets tight everything will remain respectful and do not need too much space for legs, backpacks, etc because the space is limited and you don't have to make yourself unnecessarily wide consider other guests in public transport almost daily at peak times",even if it gets tight everything will remain respectful and do not need too much space for legs backpacks etc because the space is limited and you don t have to make yourself unnecessarily wide consider other guests in public transport almost daily at peak times,False,False
,works_well,"On Time, not too packed I的m in the office in 30min. Really spontaneous with great connection Everything was good",on time not too packed i m in the office in 30min really spontaneous with great connection everything was good,False,False
,works_well,Train is almost on time,train is almost on time,False,False
,works_well,Arrival in Winterthur without further delay,arrival in winterthur without further delay,False,False
,works_well,Train's here,train s here,False,False
,works_well,Connection train is still waiting or is already there.,connection train is still waiting or is already there,False,False
,works_well,Now a short walk,now a short walk,False,False
47.497894,works_well,,,True,False
,works_well,"Chess for everyone to play Gives a playful vibe, engagements the people together. Maybe build a food court around it to combine play and food. Lakes some chess boards in other cities in Switzerland.",chess for everyone to play gives a playful vibe engagements the people together maybe build a food court around it to combine play and food lakes some chess boards in other cities in switzerland,False,False
47.4983,works_well,"Nice Park Meeting point for people Food stalls, events A park right in the old town, including a chessboard to play",nice park meeting point for people food stalls events a park right in the old town including a chessboard to play,False,False
47.498528,works_well,well designed bus station Cause its the main station more green spots like trees,well designed bus station cause its the main station more green spots like trees,False,False
,works_well,Lots of buses with lots of good connections The connections are very good planned and wave done with the informations from,lots of buses with lots of good connections the connections are very good planned and wave done with the informations from,False,False
47.500385,works_well,Transport Architecture Information poster about the construction and...,transport architecture information poster about the construction and,False,False
,works_well,"Design of the road makes calmer Before it was a normal street, me calmer now. It is new ready",design of the road makes calmer before it was a normal street me calmer now it is new ready,False,False
47.499687,works_well,Large information panel Big information board.,large information panel big information board,False,False
47.499638,works_well,"Work right out of the train station, and then you find the bus",work right out of the train station and then you find the bus,False,False
47.499454,works_well,"Entrance track 1 is very simple and large Track 1 is open to the city, which means that there is a lot of entry and the barrier-free. Leave it that way",entrance track 1 is very simple and large track 1 is open to the city which means that there is a lot of entry and the barrier free leave it that way,False,False
47.499454,works_well,Good platforms The entrance to the bus is very easy. It is flat and barrier-free. Leave it that way,good platforms the entrance to the bus is very easy it is flat and barrier free leave it that way,False,False
47.499496,works_well,cozy indoor hall at main station in contrast to other stations Winti has a cozy interior which is also well heated in winter,cozy indoor hall at main station in contrast to other stations winti has a cozy interior which is also well heated in winter,False,False
47.50046,works_well,Empty bus Pleasant journey,empty bus pleasant journey,False,False
47.499744,works_well,Roofing The roofing is very good. It lets through a lot of light and is an optimal protection in case of rain.,roofing the roofing is very good it lets through a lot of light and is an optimal protection in case of rain,False,False
47.498184,works_well,Newly restored schoolhouse Architecturally beautiful old building,newly restored schoolhouse architecturally beautiful old building,False,False
,works_well,"Restaurant near the train station I think it's good that there's a Riceup right next to Perron, because you can see from the track if the train is already there or not Pleasure before the train no something to eat",restaurant near the train station i think it s good that there s a riceup right next to perron because you can see from the track if the train is already there or not pleasure before the train no something to eat,False,False
47.49812,works_well,Good cycling Important for a continuous bicycle connection through the city Further development of bicycle connections,good cycling important for a continuous bicycle connection through the city further development of bicycle connections,False,False
47.498955,works_well,Ticket devaluer right next to the ramp for underpass The ticket evaluation works so smoothly even if you have to stress on the train. Maybe second evaluator on the other side if one breaks. At other stations you have to walk a bit along the Perron to the next dewerter. At the station Winterthur one was already broken and you had to go to the next one.,ticket devaluer right next to the ramp for underpass the ticket evaluation works so smoothly even if you have to stress on the train maybe second evaluator on the other side if one breaks at other stations you have to walk a bit along the perron to the next dewerter at the station winterthur one was already broken and you had to go to the next one,False,False
47.496414,works_well,Step-free bus access Entry and exit times are decreasing,step free bus access entry and exit times are decreasing,False,False
47.497383,works_well,Art Legal Grafitti upgrading industrial buildings Several such places in the industrial quarters,art legal grafitti upgrading industrial buildings several such places in the industrial quarters,False,False
47.499138,works_well,Super chill place on this side of the train station Nice places to sit and watch the trains! leave the cars out just as now,super chill place on this side of the train station nice places to sit and watch the trains leave the cars out just as now,False,False
47.49778,works_well,Art very nice element in front of a very large concrete wall. Makes this pass more pleasant. The elements could be green. With greening it would be even more beautiful,art very nice element in front of a very large concrete wall makes this pass more pleasant the elements could be green with greening it would be even more beautiful,False,False
47.4988,works_well,"Perfect new station underpass Wheelchair, bicycle accessible, families with stroller  At other stations",perfect new station underpass wheelchair bicycle accessible families with stroller at other stations,False,False
47.4993,works_well,Direct Park and Ride,direct park and ride,False,False
47.498863,works_well,Big old trees These large old trees enhance the space next to the industry very positively. Covers the view of the large industrial building of the municipal utilities. With more trees.,big old trees these large old trees enhance the space next to the industry very positively covers the view of the large industrial building of the municipal utilities with more trees,False,False
,works_well,Bright Lighting Makes the journy more confortable. Add more colors to the grey sourroundings.,bright lighting makes the journy more confortable add more colors to the grey sourroundings,False,False
47.498913,works_well,Great bike station  Could be a little too small in the development of residential areas,great bike station could be a little too small in the development of residential areas,False,False
47.498856,works_well,Wide well-exposed underpass Safety even at night  Winterthur Hauptbahnhof new underpass,wide well exposed underpass safety even at night winterthur hauptbahnhof new underpass,False,False
47.499493,works_well,"Bike parking directly at the train station Enough space, illuminated safely with the handle to close the bike Check so that no bikes are parked for a long time Winterthur Central Station",bike parking directly at the train station enough space illuminated safely with the handle to close the bike check so that no bikes are parked for a long time winterthur central station,False,False
,works_well,"Nice entry to station. Open, inviting Good care of the infrastructure.",nice entry to station open inviting good care of the infrastructure,False,False
47.498875,works_well,looks good,looks good,False,False
47.500744,works_well,,,True,False
47.4993,works_well,"New transition Super new connection with the city, the new quarters Hegi and Oberwinterthur Extension of the station to complete the entire project",new transition super new connection with the city the new quarters hegi and oberwinterthur extension of the station to complete the entire project,False,False
47.498962,works_well,Easy to find your track,easy to find your track,False,False
47.49888,works_well,Beautiful Trees Beautiful Trees more trees,beautiful trees beautiful trees more trees,False,False
,works_well,The Perrons are well drawn It's easy to find the right exit edge,the perrons are well drawn it s easy to find the right exit edge,False,False
,works_well,"Refreshing station design Adds Character to the station Refurbishment, inclusion in the new station rebuild.",refreshing station design adds character to the station refurbishment inclusion in the new station rebuild,False,False
,works_well,Nice and quick connection. Convenient transfer bus-train in the future. With good maintenance,nice and quick connection convenient transfer bus train in the future with good maintenance,False,False
47.49592,works_well,"White walls The knowledge walls are very meaningful in the underpass as they light up the underpass very strongly with little energy If this looks sterile, you could distribute very small paintings on metal plates on the wall",white walls the knowledge walls are very meaningful in the underpass as they light up the underpass very strongly with little energy if this looks sterile you could distribute very small paintings on metal plates on the wall,False,False
47.499207,works_well,Bicycle parking system covered bicycle storage system. The system could be made even safer and it definitely needs more parking spaces.,bicycle parking system covered bicycle storage system the system could be made even safer and it definitely needs more parking spaces,False,False
47.49899,works_well,Bicycle parking space a good covered bike parking space. It takes more parking space. The capacity of this storage system is now almost reached. The bicycle storage system could be made even safer.,bicycle parking space a good covered bike parking space it takes more parking space the capacity of this storage system is now almost reached the bicycle storage system could be made even safer,False,False
47.498962,works_well,,,True,False
47.499474,works_well,Super train journey Comfort,super train journey comfort,False,False
47.499023,works_well,wide modern Perrons wide and clear Perrons with our very sympathetic lecturers ;—) The roofing could be nicer.,wide modern perrons wide and clear perrons with our very sympathetic lecturers the roofing could be nicer,False,False
47.49941,works_well,"interesting design of the perron roofs The perron roofs are otherwise the same everywhere, by being different here it makes it a special station",interesting design of the perron roofs the perron roofs are otherwise the same everywhere by being different here it makes it a special station,False,False
47.499947,works_well,"Bicycle parking space Bike parking places are very important. The parking spaces could be considered and are not so safe depending on the location, as they are located directly on the road.",bicycle parking space bike parking places are very important the parking spaces could be considered and are not so safe depending on the location as they are located directly on the road,False,False
47.498436,works_well,Old Town beautiful quiet car-free old town. Invites to linger. more greening,old town beautiful quiet car free old town invites to linger more greening,False,False
,works_well,Return,return,False,False
,works_well,Train's on time.,train s on time,False,False
,works_well,Train is punctual,train is punctual,False,False
,works_well,Connecting train is waiting.,connecting train is waiting,False,False
,works_well,Just arrived on time.,just arrived on time,False,False
47.494663,works_well,Clean bus,clean bus,False,False
47.275707,works_well,there is light that you see something in the evening you need light to see always control the sources of light that they work properly evening in bus and trains,there is light that you see something in the evening you need light to see always control the sources of light that they work properly evening in bus and trains,False,False
47.27086,works_well,it is taken into account for people with limitations All must be included and have the possibility to use public transport. Respect for All People Generally in buses and trains,it is taken into account for people with limitations all must be included and have the possibility to use public transport respect for all people generally in buses and trains,False,False
47.501038,works_well,Good location Very good: drinking well nearby,good location very good drinking well nearby,False,False
47.500793,works_well,View New Underpass Helpful hint which stairs to use,view new underpass helpful hint which stairs to use,False,False
47.500977,works_well,Pleasant waiting room,pleasant waiting room,False,False
47.500916,works_well,Separate underpass,separate underpass,False,False
47.504524,works_well,"All buses are punctual. Time of the picture is 08:00, that the buses arrive with punctuality is important because most usera use the public transport to commute to work. Our jobs are dependable of the constant continuity of the buses. Even though they arrive at the estimated time the wait between buses of the same line is between 10 and 20 min, meaning that if an user doesn't catch one, the next one would be too late to get on time to the destination. Same problem applies if one bus is late and 3 buses of the same line arrive with 2 min of difference between each other. Just other bus lines in Winterthur and other cities in Switzerland, only buses though.",all buses are punctual time of the picture is 08 00 that the buses arrive with punctuality is important because most usera use the public transport to commute to work our jobs are dependable of the constant continuity of the buses even though they arrive at the estimated time the wait between buses of the same line is between 10 and 20 min meaning that if an user doesn t catch one the next one would be too late to get on time to the destination same problem applies if one bus is late and 3 buses of the same line arrive with 2 min of difference between each other just other bus lines in winterthur and other cities in switzerland only buses though,False,False
